Companyname,Phone,Address
Ac repair - Ac repair Services fridge washing machine repair in Hyderabad,077310 01005,"H.NO: 8-77 Swathi Estates, vikasnagar, Dilsukhnagar,, near Andhra Bank, Hyderabad, Telangana 500060"
Gas Stove Repair Door Service Home Service URBAN EXPERTS Hyderabad Secundrabad,086888 85744,"1-7-92/2,202, Madhura Puri Colony, Dilsukhnagar, Hyderabad, Telangana 500060"
Balaji Gas Stove Repair Centre,078010 45188,"7-50, Beside Konark Theatre Lane Madhurapuri,, Dilshuknagar, Hyderabad, Telangana 500060"
RS Home Appliance Services,063037 73590,"2-3-603/7/12/31, Ramanthapur, Patel Nagar, Amberpet, Hyderabad, Telangana 500013"
Unitech Home Appliances,090004 44706,"2-2-185/3/6, Ramakrishna Nagar, Amberpet, Hyderabad, Telangana 500013"
S.B Refrigerator Service Centre,091609 52210,"11-212, Teegala Guda, East Prasanth Nagar, Moosarambagh, Hyderabad, Telangana 500036"
Prime Aircon - Ac Repair Services Near me Installation Best Split Ac Repair doorstep in Hyderabad | Fridge repair near me,079974 75201,"1-5-237, 1, Rd No. 2, Phanigiri Colony, Kothapet, Hyderabad, Telangana 500035"
Godrej Refrigerator Service Cente,085002 57253,"Road Number 9, Dwarakapuram Main Rd, Moosa Ram Bagh, Dilsukhnagar, Hyderabad, Telangana 500060"
Reliance ResQ Service Center - ResQ Satellite Centre Dilusuk Nagar,1800 889 1044,"ResQ Satellite Centre Dilusuk Nagar, Ground floor to Third Floor H Np:- 16-11, 447/6, Moosarambagh Rd, Dilshuk nagar, Hyderabad, Telangana 500036"
"Gas Stove Repair Home Service lbnagar,Uppal,Nagole",086888 85744,"Sai Nursing Home, H.No 17-2-530 1st Floor, Saidabad, Hyderabad, Telangana 500059"
Quick Aircon - Fridge Washing Machine AC Apppliances Repair Services in Hydrabad,099857 78226,"2-3734/51, 6 Number X Rd, Zinda Tilismath Nagar, Amberpet, Hyderabad, Telangana 500013"
KSR Gas Stove Repair Door Service,099496 88582,"11-1-137,Bapu nager,road no 1 saroor nager, Hyderabad, Telangana 500035"
Bosch Washing Machine Service Center in Dilsukhnagar Hyderabad,073823 84479,"H. No. 16, 16, SBI Colony, Moosarambagh, Hyderabad, Telangana 500036"
Bright Electronics,098662 50703,"Shop No: 16-741, Sri Veda Residency, D/105, Shalivahana Nagar, Sarita Arcade, SBI Colony, Moosarambagh, Hyderabad, Telangana 500060"
Samsung Refrigerator Service Centre in Secunderabad Hyderabad,085001 31692,"Saibaba Colony, Lalitha Residency, Sharada Nagar, Dilsukhnagar, Hyderabad, Telangana 500035"
Bhanu Refrigeration Works,093924 28055,"H. No. 1-10-2/2, Beside SBH ATM, Depot Backside,, Dilsukhnagar, Hyderabad, Telangana 500060"
Whirlpool washing machine service & repair center in hyderabad,094403 92707,"6-59, Shalivahana Nagar, Sarita Arcade, SBI Colony, Dilsukhnagar, Hyderabad, Telangana 500060"
Reliance ResQ Service Center - Logic solutions,1800 889 1044,"Logic Solutions, Plot No. M10, 1st Floor, Saleem Nagar Colony, East Prasanth Nagar, Hyderabad, Telangana 500036"
Samsung Microwave Oven Services Center In Dilsukhnagar,085001 72971,"9G7F+C76, Kanchi Residency, Sahithi Nagar, Dilsukhnagar, Hyderabad, Telangana 500060"
Whirlpool Refrigerator Single Door Service Center,085007 01716,"Pratap Nagar, Dilsukhnagar, Hyderabad, Telangana 500060"
ac repair services hyderabad,077025 31405,"1-11-13, near bank of baroda, Balaji Residency, Moosa Ram Bagh, Dilsukhnagar, Hyderabad, Telangana 500060"
Godrej Microwave Service Center in Dilsukhnagar,089850 54072,"1-25/36, Hanumannagar, Krishna Nagar, Dilsukhnagar, Hyderabad, Telangana 500060"
Polar General Services,088855 90218,"16-11-511/D/361, st, 9, Shalivahana Nagar, Moosarambagh, Hyderabad, Telangana 500036"
sasri services,099125 16558,"1-42 plot, AP State Housing Board, Hanumannagar, Dilsukhnagar, Hyderabad, Telangana 500060"
Glen Gallery,092921 56156,"56, AP State Housing Board, Durga Nagar, Krishna Nagar, Dilsukhnagar, Hyderabad, Telangana 500060"
washing machine clinic,079971 00062,"Flat: 1, 10-7, Bus Depot Rd, behind Dilsukhnagar, Dwarakapuram, Dilsukhnagar, Hyderabad, Telangana 500036"
Whirlpool Washing machine repair service in Saroornagar,085004 70686,"Rd Number 14, Saroornagar, Singareni Colony, Saroor Nagar East, Hyderabad, Telangana 500035"
Mr. Fixit-Electric & Plumbing Services,081063 17152,"2-3-512/b/101, Chenna Reddy Nagar, Amberpet, Hyderabad, Telangana 500013"
Godrej Refrigerator Service Center,073822 19781,"9G8G+24R, Goutham Nagar Colony, Kalyani Estate, Madhura Puri Colony, Dilsukhnagar, Hyderabad, Telangana 500060"
Anand Gas Tech,092462 01373,"Annapurna Complex, Main Road Metro Pillar No 11,, Opp. PAI Electronic Showroom, Dilsukhnagar, Hyderabad, Telangana 500036"
Mimi Refrigerators works,081212 70845,"10-1-92/3/20A Janaki enclave Road no 5 Karmanghat, Saroornagar, Hyderabad, Telangana 500035"
God Gift - AC Works AC Repair Services in Hyderabad AC installation Fridge Repair services Lb nagar,089193 44041,"H.no.03-06-381/1,shop no. 2 Krishna nagar bhadurguda lb nagar to saroor nagar road Near tnr apts, L. B. Nagar, Telangana 500074"
Global Engineering Works,099491 98056,"C block, 2-3-512/c/80, Bapunagar Rd, near Noor masjid, Chenna Reddy Nagar, Ratan Nagar, Amberpet, Hyderabad, Telangana 500013"
SS Home Appliance Repair Service,098491 49236,"2/3, 647/1/42, Azad Nagar Rd, Azad Nagar, Amberpet, Hyderabad, Telangana 500013"
Refrigerator Repair Service Center,073820 09629,"3-1-18, Ramanthapur, Venkat Reddy Nagar, Habsiguda, Hyderabad, Telangana 500013"
Samsung Microwave Oven service Center,089854 79540,"Vijaya Residency, Kamala Nagar, Dilsukhnagar, Hyderabad, Telangana 500060"
TV REPAIR CENTER N HYDERABAD,085004 24550,"17-74/5, Road Number 3, Vijeta Kalyan Enclave, Srinagar Colony, Dilsukhnagar, Hyderabad, Telangana 500060"
sri bhavani technocare services,099599 71000,"vision eye clinic, 16-11-741/D/94/A,shalivahana nagar,dilsukhnagar,beside:max, Hyderabad, Telangana 500036"
LG Refrigerator Service Center,073821 09989,"9GCC+CGQ, Indira Nagar, Dilsukhnagar, Hyderabad, Telangana 500036"