Companyname,Phone,Address
pestosol pest control services,087123 03472,"reddy brothers line, 20/122/g, VV Nagar Rd, Chaitanyapuri, Hyderabad, Telangana 500060"
Asian Pest Control Services - Best pest control in Hyderabad,098850 52927,"16-2-708/2/1 , Beside D-Mart, Malakpet, Hyderabad, Telangana 500036"
Pest Control Services Hyderabad,081878 00555,"11-19-74, main road, opposite to Mandal Revenue Office, Saroornagar, Doctors Colony, JB Colony, Hyderabad, Telangana 500035"
Pest Control Service In Hyderabad,092944 03807,"Plot No 21, 46, VV Nagar, Lalitha Residency, Sharada Nagar, Dilsukhnagar, Hyderabad, Telangana 500034"
Bugzap pest control management,074162 38692,"Flat no. 109, City centre Complex, beside South India Shopping mall, polkampally, Margadarshi Colony, Kothapet, Hyderabad, Telangana 500035"
eco pestcontrol,090009 74286,"plot no 24/A, Green Hills Colony Rd Number 3, polkampally, Dwarka Nagar, Kothapet, Hyderabad, Telangana 500035"
Om Sai Electrician And Pest Control Services,063760 78208,"Ashtalakshmi Mandir Kaman, Dilsukhnagar, Road No. 5, Kothapet, Hyderabad, Telangana 500035"
NSK aayush PestControl services,090323 62246,"Sarada Nagar, Amberpet, Hyderabad, Telangana 500013"
Sreepesto Solutions India Pvt Ltd,099634 69777,"5th Floor, x, 1-1-89, Main Rd, above Ratnadeep, Indira Nagar, Habsiguda, Hyderabad, Telangana 500007"
Prime Pest Control Services,099850 09163,"1-9-670/2/srt ,satayanagar, Vidya Nagar, Adikmet, Hyderabad, Telangana 500044"
Perfect Pest & Anti Termite Services,077022 52495,"Ramanthapur, Venkat Reddy Nagar, Ramanthapur, Hyderabad, Telangana 500013"
Arise Pest Control services | Termite pest Cockroaches bed bugs pest control services in Hyderabad | Top commercial low cost,070365 36560,"H.NO:3-6-371/2,Flat No:42, Road No-3, Saroor Nagar Rd, Krishna Nagar Colony, L. B. Nagar, Hyderabad, Telangana 500074"
First Choice Pest Control Pvt Ltd,089882 23333,"# D.No : 2-1-514/3/1, behind State Bank of India, New Nallakunta, Hyderabad, Telangana 500044"
Midhuna Pest Control Services Hyderabad,087903 52356,"shop No.8-1, 29/1, Jyothi Nagar, Kharmanghat, Telangana 500079"
999 Pest Control Services,088855 14883,"5-10-188/B4, Behind Income Tax Building, Basheer Bagh, Hyderabad, Telangana 500004"
JLY Pest Control service,099125 52263,"Bapu Nagar, Amberpet, Hyderabad, Telangana 500013"
PEST CONTROL HYDERABAD,098491 74222,"15-21-150/36/A, near Sai Baba Temple, Balaji Nagar, Kukatpally, Hyderabad, Telangana 500072"
MY Mark Pest Control Services In Hyderabad,099497 00744,"2-3-647/B/248 Police Line, Premnagar, Amberpeet, Hyderabad, Telangana 500013"
HYDERABAD PEST CONTROL PVT.LTD.,098859 66190,"shop no.327,LPT market ,Opp.BVK theatre,L B Nagar, Hyderabad,500074 L B nagar , beside shah ghouse resturant hayathnagar road ,vijaywada heighway, Hyderabad, Telangana 500074"
SS Pest Service Provider,092462 76888,"8-5-154 Old Village, Kharmanghat, Telangana 500079"
Prompt Pest Control Services,096765 98686,"GHMC Park, Near, #1-10-122/A/2, Ashok Nagar Road, Hyderabad, Telangana 500020"
Deccan Pest Control Services | Termite pest control services | cockroach pest control service | pest control in Hyderabad,096666 48420,"Mustafa towers Flat no 402 F, 4 th floor, near Krishna childrens hospital, Lakdikapul, Hyderabad, Telangana 500004"
Deccan Pest Control Services PVT . LTD | Termite pest control | Cockroach pest control | pest control service in Hyderabad .,098851 42221,"1-129/190/C, 14, 1-129/180, Padmavati Nagar, NRR Puram, Borabanda, Hyderabad, Telangana 500018"
V24 Pest Control And Solutions,076600 00247,"V24 PEST CONTROL AND SOLUTIONS PLOT NO 42,H.NO 3-9-422/B CHINTAL KUNTA SRI, 4, Saraswathi Nagar, L. B. Nagar, Hyderabad, Telangana 500074"
Vinay Pest Control Services in Hyderabad Termite pest control bed bugs Cockroaches pest Control services pest control service,091213 82270,"H.No, 1-2-184, SBI Colony Rd, SBI Colony, Kothapet, Hyderabad, Telangana 500035"
SS Pest Control Service - Best Pest Control Services in Hyderabad,092462 76888,"Flat no 16, MIG 2, water board housing quarters, BLOCK 35, Bagh Lingampally Rd, AP Housing Board, Bagh Lingampally, New Nallakunta, Hyderabad, Telangana 500044"
Trusted Pest Control Services Hyderabad,085005 20023,"Sai Lal Thota, Uppar Guda, Kurmaguda, Hyderabad, Telangana 500059"
Independent pest management,076759 27222,"22-11, VR Colony, Vivekananda Nagar, Dilsukhnagar, Hyderabad, Telangana 500060"
Hitech Pest Control Services,098851 80118,"#3-2-43, Opp Ambetkar Committe Hall, Old Ramanthapur, Ramanthapur, Hyderabad, Telangana 500013"
Raksha Hygiene Services,090303 33621,"#1-8-88/31/12, Bagahalingmpaaly Main Road, Near APSRTC Kalyana mantap, Achiih Nag Hyderabad, Hyderabad, 500044"
AJL Pest Control Services,097033 11339,"lat No.302, Soukhya Pride Residency, Plot No. 38, Mahadevapuram, ALEAP Industrial Area, Gajularamaram, Hyderabad, Telangana 500055"
Bugzap pest control management,074162 38692,"17-1-383, S/1, IS Sadan Rd, Vinay Nagar Colony, Vinayak Nagar Colony, Saidabad, Hyderabad, Telangana 500059"
East India Pest Control Services,077949 90111,"Number 3, H.No 11-9, 120/3, Vijayapur Colony Rd, Kothapet, Hyderabad, Telangana 500035"
Sai Pest Control Corpn,040 2404 6672,"1-5-556, New Maruthi Nagar, Road No 2, Dilsukh Nagar, Near Sadhana Play School, Dilsukh Nagar, Hyderabad, Telangana 500060"
INDIAN PEST CARE SERVICES,090143 89967,"Sumitra Sapandana Enclave, Padma Colony, New Nallakunta, Hyderabad, Telangana 500044"
H P C I : Horizon Pest Control India Pvt Ltd,091600 00333,"9-8-48/2, Road No 2,, Maruthi Nagar, Santosh Nagar, Opp ICICI Bank, Hyderabad, Telangana 500059"
Meghana Pest Control Services మేఘన పెస్ట్ కంట్రోల్ సర్వీసెస్,092929 05006,"H. No. 17, 1-382/5/6/B, Balaji Nagar, Saroor Nagar East, Champapet, Hyderabad, Telangana 500079"
Gk pest control service,081431 11813,"8-1-138 old village Karmanghat near swaraswathi school Hyderabad mandal Saroonagar, Hyderabad, Telangana 500079"
PEST CONTROL SERVICES IN HYDERABAD,077949 42931,"9-110 77/3, Gayatri Nagar Road Colony, Boduppal, Hyderabad, Telangana 500039"
Golden Pest Care,+1 918-212-6175,"Sai Baba Temple Rd, beside Dilsukhnagar, Anamangal Kumari kunta, Madhura Puri Colony, Dilsukhnagar, Hyderabad, Telangana 500060"
Nagadurga Pest Control,098497 13192,"2-1-15/4, AP Housing Board, Bagh Lingampally, New Nallakunta, Hyderabad, Telangana 500044"
Carenow Pest Control Services,085200 06465,"HNO: 10-6-25/A, Saroornagar, Trimurti Colony, Huda Colony, Hyderabad, Telangana 500060"
Pest Control Specialist (India) Services,098492 14156,"Plot No 17, 12-1-426/6, Aaditya Nagar, Gsi Post, Bandlaguda Nagole, Aaditya Nagar, Hyderabad, Telangana 500068"
"Termite Pest Control Hyderabad, Cockroach Control - Viluna Pest Control",090599 69683,"Flat No:215, City Tower, Nalgonda X Road, Malakpet, Hyderabad, Telangana 500036"
Pest control Pavan,095736 86693,"Balaji Enclave, Beerappagadda, Uppal, Hyderabad, Telangana 500039"
Expert Pest Control Services,097052 06895,"Plot No.13-21, Bus stop, 52, VV Nagar Rd, Chaitanyapuri, Dilsukhnagar, Hyderabad, Telangana 500060"
Easy hi care Pest Control,090323 18994,"2-3-603/50/A/67, Premnagar, Patel Nagar, Amberpet, Hyderabad, Telangana 500013"
Surya Pest Control Services,090323 09722,"H no. 1-9-302, Ground Floor, Spencers backside, Vidyanagar, Hyderabad, Telangana 500044"